{
  "op": "media.scale",
  "version": 5,
  "summary": "Downscale a video to a target height, preserving aspect, and re-encode at a named profile.",
  "needs": ["video_encode"],
  "judgement": false,
  "parity": {
    "mode": "bit_exact",
    "note": "Deterministic for a fixed ffmpeg build: libx264 at a pinned preset/crf over identical input bytes emits identical output bytes. The condition is the BUILD, not the box — local and pod run the same pinned ffmpeg, and the engine's parity test for this op asserts the argv is a pure function of params so a drift shows as an argv diff rather than as mystery-different pixels. Across ffmpeg majors this degrades to perceptual; that is a version-pin problem and belongs to the image, not to this op. ORDER: the tonemap runs AFTER the scaler on this op and BEFORE it on media.normalize, and the two are deliberately not the same spelling of one rule. Normalize is INGEST — it keeps native resolution and ingest_normalize measures autograde THROUGH that exact prefix — while a proxy discards ~89% of the pixels a leading tonemap would convert (measured on run img-8010: 12.649 s for the one HDR source against 2.5-3.5 s for its SDR neighbours; 9.01 s -> 2.73 s replayed with the scale first). hable is non-linear, so scaling the tonemapped frame and tonemapping the scaled one differ below what a player shows but NOT bit-for-bit. That is why this bumped the op version: a result cache keyed on it must not hand back a proxy encoded under the old order."
  },
  "inputs": [
    {"id": "src", "kind": "video"}
  ],
  "outputs": [
    {"id": "dst", "kind": "video", "durable": true}
  ],
  "params": {
    "type": "object",
    "additionalProperties": false,
    "required": ["height", "encode_profile"],
    "properties": {
      "height": {
        "type": "integer",
        "minimum": 16,
        "maximum": 4320,
        "multipleOf": 2,
        "description": "Target height in pixels. Width follows from the source aspect (-2 = nearest even). The DECISION is 'how big'; how it is scaled is the handler's."
      },
      "height_mode": {
        "enum": ["exact", "at_most"],
        "default": "exact",
        "description": "How `height` meets the source. `exact` scales to it in either direction — today's behaviour, the default, and byte-for-byte the argv a chain built by an older engine has always produced. `at_most` clamps to min(height, source height): the pod already holds the file open, so 'do not upscale' is decided where the number lives instead of costing the caller one header probe per candidate — ~50 of them on a real palette, and on a box that may hold no media not a probe it can make at all. GEOMETRY either way, and still the caller's `height`: nothing here says which tier chose it. Same polarity as `tonemap: auto` and as media.filmstrip measuring duration instead of being told it."
      },
      "encode_profile": {
        "enum": ["proxy", "browser", "preview", "final"],
        "description": "Named quality tier, NOT encoder flags. `-preset veryfast -crf 26` is tuning and stays in the handler (the engine's render-profile table is the same SSOT pattern). Sending argv here would publish the encoder ladder and void additionalProperties:false. `proxy` and `browser` differ by READER, not by taste: `proxy` is the film the FACE DETECTOR decodes — a trajectory is measured on those pixels and baked into the master the caller ships — so it is frozen; `browser` is a copy only the player ever opens, and the owner has ruled that the preview need not be at master quality."
      },
      "audio": {
        "enum": ["copy", "drop"],
        "default": "copy"
      },
      "seek": {
        "type": "number",
        "minimum": 0,
        "maximum": 86400,
        "description": "Start this many seconds into the source. GEOMETRY on the source's own axis, the same class of fact as `height` — nothing here says which beat chose it or why. Absent (or 0) = from the start, byte-for-byte the pre-window argv. Without it a cutaway proxy encodes the WHOLE master: measured 10.1 s per ref against ~4 s for the window that is actually played."
      },
      "duration": {
        "type": "number",
        "exclusiveMinimum": 0,
        "maximum": 86400,
        "description": "Encode only this many seconds from `seek`. Geometry, paired with `seek`; absent = to the end."
      },
      "fps": {
        "anyOf": [
          {"type": "integer", "minimum": 1, "maximum": 240},
          {"type": "string", "pattern": "^[1-9]\\d*/[1-9]\\d*$"}
        ],
        "description": "Resample to this constant frame rate. Stock lands at 23.976 or 25 and a player left to retime it live JUDDERS. The integer branch keeps media.normalize.fps's spelling and range. An exact rational rate may cross instead as a \"num/den\" string of positive integers with no leading zeros (e.g. \"30000/1001\"), so a proxy can land on a 29.97 grid exactly rather than on a truncated 29 or 30; an integer keeps its meaning. Absent = the source's own rate, unchanged."
      },
      "tonemap": {
        "enum": ["none", "hlg", "pq", "auto"],
        "default": "none",
        "description": "Source HDR transfer to tonemap SDR→bt709. The enum and the zscale+tonemap=hable chain are media.normalize's, imported rather than respelled, so ingest and a preview cannot disagree about what HLG becomes. `auto` MEASURES the source's transfer in the handler — the only place the file exists on the pod contour, and the same polarity as media.filmstrip measuring duration instead of being told it. Without this an HLG stock cutaway previews washed out."
      }
    }
  },
  "handler": "montyops.media_scale:run"
}
