{
  "op": "camera.apply",
  "version": 2,
  "summary": "Bake the talking-head camera onto the clean cut: a rect-keyframe crop trajectory rendered to pixels (GPU libplacebo, CPU-static fallback).",
  "needs": ["video_encode"],
  "judgement": false,
  "parity": {
    "mode": "perceptual",
    "note": "The SHOT is JUDGEMENT and never crosses (detect_track / head_geometry / plan_shots / plan_punches decide it on the brain); only the trajectory it emits crosses as params, and this op turns it into pixels. Two reasons it is not bit_exact. (1) Since MISC-141 fold round 2 the zoom-space shape (`geom` present) carries a MIX of ramp keyframes (t/z/head_x/eye_y/interp, exactly 2 per shot, the shot's own RAW cosine ramp) and punch bump keyframes (t/bump, a punch's own piecewise-linear accent) — camera_apply/podagent compose `z(t) = max(1.001, ramp(t)*(1+bump(t)))` analytically, at every frame, reproducing the engine's head-trajectory zoom builder EXACTLY rather than approximately (measured worst < 1e-3 of the frame on a real 18-shot/63s/1-accent fixture, the engine's camera-path parity test — round 1 measured 0.043 sampling the composed z into 2 points per shot). A shot count past the 80-vertex expression ceiling CHUNKS into trim+crop+concat pieces whose internal boundaries are INTEGER FRAME INDICES on the render's own frame grid (`geom.fps`) — the first frame at or AFTER the split keyframe's own time, `ceil(t*fps)` from exact rationals with no tolerance, never snapped or floored (MISC-141 fold rounds 4-5) — never RDP-thinned (invalid once a keyframe pair means \"ease this cosine\"). The legacy rect-space shape (no `geom`, keyframes carry `t`/`rect`, one top-level `interp`) is unchanged from before MISC-141 and still bakes any trajectory persisted before the fold. (2) The primary render is GPU libplacebo on BOTH local and pod (the dev box and the rented pod both have Vulkan), so those two agree structurally — the crop filtergraph is pinned BYTE-EQUAL to the pod's rect/zoom renderers (podagent.render) in the engine's parity suite — but a Vulkan-less box (driverless CI) falls back to a STATIC crop at the first keyframe, exactly as podagent.render._cpu_crop/zoom_cpu_crop does in the final composite; that fallback is declared, not hidden. Tolerance for the GPU-vs-GPU path: PSNR >= 40 dB / SSIM >= 0.99 frame-to-frame is the intended bar (dominated by encoder quantisation, not geometry); UNPROVEN in a CPU-only environment with no GPU to run a real libplacebo render, so only the filtergraph STRINGS are pinned."
  },
  "inputs": [
    {"id": "src", "kind": "video"}
  ],
  "outputs": [
    {"id": "dst", "kind": "video", "durable": true}
  ],
  "params": {
    "type": "object",
    "additionalProperties": false,
    "properties": {
      "keyframes": {
        "type": "array",
        "minItems": 1,
        "description": "The camera trajectory as DATA. Legacy shape (no top-level `geom`): per-frame crop rects in SOURCE fractions, emitted by the engine's head-trajectory builder, eased by the single top-level `interp`. Zoom shape (`geom` present, MISC-141 fold rounds 1-2): a MIX of RAMP points (`t`/`z`/`head_x`/`eye_y`/`interp` — the shot's own zoom and centre, no punch bump or floor baked in, exactly 2 per shot) and BUMP points (`t`/`bump` only — a punch's own piecewise-linear accent); camera.apply tells the two apart by which of `z`/`bump` an entry carries and composes `max(1.001, ramp*(1+bump))` analytically. Times are seconds on the segment clock. The exact per-item shape is pinned by ARM below (a rect item cannot sneak into a zoom-shape payload or vice-versa — `additionalProperties` alone cannot see across a `oneOf` branch, so each arm restates its own `keyframes.items`)."
      },
      "interp": {
        "enum": ["linear", "ease_in", "ease_out", "ease_in_out", "cos"],
        "description": "The LEGACY shape's single top-level ease, governing every `t`/`rect` interval. Absent from the zoom shape, where each ramp keyframe carries its own `interp` instead."
      },
      "geom": {
        "type": "object",
        "additionalProperties": false,
        "required": ["crop_x", "crop_y", "sw", "sh", "cover_w", "cover_h", "ax", "ay", "fps"],
        "properties": {
          "crop_x": {"type": "number"},
          "crop_y": {"type": "number"},
          "sw": {"type": "number", "exclusiveMinimum": 0},
          "sh": {"type": "number", "exclusiveMinimum": 0},
          "cover_w": {"type": "number", "exclusiveMinimum": 0},
          "cover_h": {"type": "number", "exclusiveMinimum": 0},
          "ax": {"type": "number"},
          "ay": {"type": "number"},
          "fps": {
            "anyOf": [
              {"type": "number", "exclusiveMinimum": 0},
              {"type": "string", "pattern": "^[1-9]\\d*/[1-9]\\d*$"}
            ],
            "description": "The render's own frame rate (MISC-141 fold rounds 2-5), a positive number or an exact rational \"num/den\" string of positive integers with no leading zeros (e.g. \"30000/1001\") so a 29.97 grid's frame indices come from the exact rate rather than a float — used ONLY to express a chunk splitter's internal trim boundary as an integer FRAME INDEX (`trim=start_frame=N`, the first frame at or after the split keyframe's time, exact rational arithmetic, no tolerance), never to resample the output (camera.apply never emits an fps filter)."
          }
        },
        "description": "Source geometry + anchor + fps, constant for the whole segment (MISC-141 fold round 1-2) — camera.apply folds z back into a rect exactly as the engine's head-trajectory rect builder does. Present only on the zoom shape."
      },
      "out_w": {"type": "integer", "minimum": 16, "maximum": 3840, "multipleOf": 2},
      "out_h": {"type": "integer", "minimum": 16, "maximum": 3840, "multipleOf": 2},
      "encode_profile": {
        "enum": ["preview", "final"],
        "description": "Named quality tier, NOT encoder flags. head_dyn.mp4 is an INTERMEDIATE re-encoded downstream, so `final` runs a high-quality cq (14) to limit compounding generation loss; `preview` trades quality for the 720x1280 proxy. The nvenc/libx264 ladder is tuning and stays in the handler (the engine's render-profile table is the same SSOT pattern)."
      }
    },
    "oneOf": [
      {
        "description": "Legacy rect-space shape (pre-MISC-141, or any trajectory persisted before it).",
        "required": ["keyframes", "interp", "out_w", "out_h", "encode_profile"],
        "not": {"required": ["geom"]},
        "properties": {
          "keyframes": {
            "items": {
              "type": "object",
              "additionalProperties": false,
              "required": ["t", "rect"],
              "properties": {
                "t": {"type": "number", "minimum": 0},
                "rect": {
                  "type": "array",
                  "minItems": 4,
                  "maxItems": 4,
                  "items": {"type": "number", "minimum": 0, "maximum": 1},
                  "description": "[x, y, w, h] crop window, each in [0,1]."
                }
              }
            }
          }
        }
      },
      {
        "description": "Zoom-space shape (MISC-141 fold rounds 1-2).",
        "required": ["keyframes", "geom", "out_w", "out_h", "encode_profile"],
        "not": {"required": ["interp"]},
        "properties": {
          "keyframes": {
            "items": {
              "oneOf": [
                {
                  "type": "object",
                  "additionalProperties": false,
                  "required": ["t", "z", "head_x", "eye_y", "interp"],
                  "properties": {
                    "t": {"type": "number", "minimum": 0},
                    "z": {"type": "number", "exclusiveMinimum": 0},
                    "head_x": {"type": "number"},
                    "eye_y": {"type": "number"},
                    "interp": {
                      "enum": ["linear", "ease_in", "ease_out", "ease_in_out", "cos"],
                      "description": "How this keyframe's interval eases into the next. MISC-141 fold round 2 always emits \"cos\" here — a ramp point is exact between a shot's own two boundaries."
                    }
                  },
                  "description": "A RAMP point: the shot's own z/centre, no punch bump or floor baked in."
                },
                {
                  "type": "object",
                  "additionalProperties": false,
                  "required": ["t", "bump"],
                  "properties": {
                    "t": {"type": "number", "minimum": 0},
                    "bump": {"type": "number", "minimum": 0}
                  },
                  "description": "A BUMP point: a punch's own additive accent — always linear, no `interp` carried."
                }
              ]
            }
          }
        }
      }
    ]
  },
  "handler": "montyops.camera_apply:run"
}
